//UC1
mysql> create database addressbookservice;
Query OK, 1 row affected (0.01 sec)

mysql> show databases;
+--------------------+
| Database           |
+--------------------+
| addressbookservice |
| db                 |
| information_schema |
| mysql              |
| payroll_service    |
| performance_schema |
| sakila             |
| sys                |
| world              |
+--------------------+
9 rows in set (0.00 sec)

mysql> use addressbookservice;
Database changed
mysql> select database();
+--------------------+
| database()         |
+--------------------+
| addressbookservice |
+--------------------+
1 row in set (0.00 sec)


//UC2
mysql> create table AddressBook
    -> (
    -> firstname varchar(150) Not Null,
    -> lastName varchar(50) Not Null,
    -> address varchar(50) Not Null,
    -> city varchar(50) Not Null,
    -> State varchar(50) Not Null,
    -> zip varchar(50) Not Null,
    -> phoneNumber varchar(10) Not Null,
    -> email varchar(50) Not Null,
    -> primary key(firstname)
    -> );
Query OK, 0 rows affected (0.06 sec)

//description of the created table
mysql> describe AddressBook;
+-------------+--------------+------+-----+---------+-------+
| Field       | Type         | Null | Key | Default | Extra |
+-------------+--------------+------+-----+---------+-------+
| firstname   | varchar(150) | NO   | PRI | NULL    |       |
| lastName    | varchar(50)  | NO   |     | NULL    |       |
| address     | varchar(50)  | NO   |     | NULL    |       |
| city        | varchar(50)  | NO   |     | NULL    |       |
| State       | varchar(50)  | NO   |     | NULL    |       |
| zip         | varchar(50)  | NO   |     | NULL    |       |
| phoneNumber | varchar(10)  | NO   |     | NULL    |       |
| email       | varchar(50)  | NO   |     | NULL    |       |
+-------------+--------------+------+-----+---------+-------+
8 rows in set (0.01 sec)

//uc3:To insert 

mysql> insert into AddressBook(firstname,lastName,address,city,state,zip,phoneNumber,email) values
    -> ('priya','pandey','jindal','bangalore','karnataka','560073','888432756','priyapandey@gmail.com');
    -> ('niraj','singh','m.n.halli','hospiyarpur','punjab','560087','9739927107','nirajsingh@gmail.com');
    -> ('neha','shukla','marathalli','bangalore','karnataka','560037','7899927018','nehashukla@gmail.com');
    -> ('abhishek','pandey','srs','nagpur','mumbai','345678','9008938916','abhi@gmail.com');
    -> ('adarh','kumar','khemapur','bhadhoi','UttarPradesh','678978','8884327526','adi@gmail.com');
Query OK, 1 row affected (0.00 sec)


mysql> select * from AddressBook;
+-----------+----------+------------+-------------+--------------+--------+-------------+-----------------------+
| firstname | lastName | address    | city        | State        | zip    | phoneNumber | email                 |
+-----------+----------+------------+-------------+--------------+--------+-------------+-----------------------+
| abhishek  | pandey   | srs        | nagpur      | mumbai       | 345678 | 9008938916  | abhi@gmail.com        |
| adarh     | kumar    | khemapur   | bhadhoi     | UttarPradesh | 678978 | 8884327526  | adi@gmail.com         |
| neha      | shukla   | marathalli | bangalore   | karnataka    | 560037 | 7899927018  | nehashukla@gmail.com  |
| niraj     | singh    | m.n.halli  | hospiyarpur | punjab       | 560087 | 9739927107  | nirajsingh@gmail.com  |
| priya     | pandey   | jindal     | bangalore   | karnataka    | 560073 | 888432756   | priyapandey@gmail.com |
+-----------+----------+------------+-------------+--------------+--------+-------------+-----------------------+
5 rows in set (0.00 sec)

//UC4:Ability to edit:UPDATE Command


mysql> UPDATE AddressBook set phoneNumber = "7760500273" where firstname = 'priya';
Query OK, 1 row affected (0.00 sec)
Rows matched: 1  Changed: 1  Warnings: 0

mysql> select * from AddressBook;
+-----------+----------+------------+-------------+--------------+--------+-------------+-----------------------+
| firstname | lastName | address    | city        | State        | zip    | phoneNumber | email                 |
+-----------+----------+------------+-------------+--------------+--------+-------------+-----------------------+
| abhishek  | pandey   | srs        | nagpur      | mumbai       | 345678 | 9008938916  | abhi@gmail.com        |
| adarh     | kumar    | khemapur   | bhadhoi     | UttarPradesh | 678978 | 8884327526  | adi@gmail.com         |
| neha      | shukla   | marathalli | bangalore   | karnataka    | 560037 | 7899927018  | nehashukla@gmail.com  |
| niraj     | singh    | m.n.halli  | hospiyarpur | punjab       | 560087 | 9739927107  | nirajsingh@gmail.com  |
| priya     | pandey   | jindal     | bangalore   | karnataka    | 560073 | 7760500273  | priyapandey@gmail.com |
+-----------+----------+------------+-------------+--------------+--------+-------------+-----------------------+
5 rows in set (0.00 sec)


//uc5:to delete


mysql> DELETE from AddressBook where firstname='adarh';
Query OK, 1 row affected (0.00 sec)

mysql> select * from AddressBook;
+-----------+----------+------------+-------------+-----------+--------+-------------+-----------------------+
| firstname | lastName | address    | city        | State     | zip    | phoneNumber | email                 |
+-----------+----------+------------+-------------+-----------+--------+-------------+-----------------------+
| abhishek  | pandey   | srs        | nagpur      | mumbai    | 345678 | 9008938916  | abhi@gmail.com        |
| neha      | shukla   | marathalli | bangalore   | karnataka | 560037 | 7899927018  | nehashukla@gmail.com  |
| niraj     | singh    | m.n.halli  | hospiyarpur | punjab    | 560087 | 9739927107  | nirajsingh@gmail.com  |
| priya     | pandey   | jindal     | bangalore   | karnataka | 560073 | 7760500273  | priyapandey@gmail.com |
+-----------+----------+------------+-------------+-----------+--------+-------------+-----------------------+
4 rows in set (0.00 sec)

//UC6 :to retrieve


mysql> select * from AddressBook;
+-----------+----------+------------+-------------+-----------+--------+-------------+-----------------------+
| firstname | lastName | address    | city        | State     | zip    | phoneNumber | email                 |
+-----------+----------+------------+-------------+-----------+--------+-------------+-----------------------+
| abhishek  | pandey   | srs        | nagpur      | mumbai    | 345678 | 9008938916  | abhi@gmail.com        |
| neha      | shukla   | marathalli | bangalore   | karnataka | 560037 | 7899927018  | nehashukla@gmail.com  |
| niraj     | singh    | m.n.halli  | hospiyarpur | punjab    | 560087 | 9739927107  | nirajsingh@gmail.com  |
| priya     | pandey   | jindal     | bangalore   | karnataka | 560073 | 7760500273  | priyapandey@gmail.com |
+-----------+----------+------------+-------------+-----------+--------+-------------+-----------------------+
4 rows in set (0.00 sec)


mysql> select * from AddressBook where city = "bangalore";
+-----------+----------+------------+-----------+-----------+--------+-------------+-----------------------+
| firstname | lastName | address    | city      | State     | zip    | phoneNumber | email                 |
+-----------+----------+------------+-----------+-----------+--------+-------------+-----------------------+
| neha      | shukla   | marathalli | bangalore | karnataka | 560037 | 7899927018  | nehashukla@gmail.com  |
| priya     | pandey   | jindal     | bangalore | karnataka | 560073 | 7760500273  | priyapandey@gmail.com |
+-----------+----------+------------+-----------+-----------+--------+-------------+-----------------------+
2 rows in set (0.00 sec)

//uc7:to understand the size using count


mysql> select * from AddressBook;
+-----------+----------+------------+-------------+-----------+--------+-------------+-----------------------+
| firstname | lastName | address    | city        | State     | zip    | phoneNumber | email                 |
+-----------+----------+------------+-------------+-----------+--------+-------------+-----------------------+
| abhishek  | pandey   | srs        | nagpur      | mumbai    | 345678 | 9008938916  | abhi@gmail.com        |
| neha      | shukla   | marathalli | bangalore   | karnataka | 560037 | 7899927018  | nehashukla@gmail.com  |
| niraj     | singh    | m.n.halli  | hospiyarpur | punjab    | 560087 | 9739927107  | nirajsingh@gmail.com  |
| priya     | pandey   | jindal     | bangalore   | karnataka | 560073 | 7760500273  | priyapandey@gmail.com |
+-----------+----------+------------+-------------+-----------+--------+-------------+-----------------------+
4 rows in set (0.00 sec)

mysql> select city,count(city) as count from AddressBook group by city;
+-------------+-------+
| city        | count |
+-------------+-------+
| nagpur      |     1 |
| bangalore   |     2 |
| hospiyarpur |     1 |
+-------------+-------+
3 rows in set (0.00 sec)

mysql> select state,count(state) as count from AddressBook group by state;
+-----------+-------+
| state     | count |
+-----------+-------+
| mumbai    |     1 |
| karnataka |     2 |
| punjab    |     1 |
+-----------+-------+
3 rows in set (0.00 sec)

//UC8:To retrieve alphabetically


mysql> select firstname,city from AddressBook;
+-----------+-------------+
| firstname | city        |
+-----------+-------------+
| abhishek  | nagpur      |
| neha      | bangalore   |
| niraj     | hospiyarpur |
| priya     | bangalore   |
+-----------+-------------+
4 rows in set (0.00 sec)

//to retrieve city in alphabetically way  

mysql> select firstname,lastName from AddressBook order by city;
+-----------+----------+
| firstname | lastName |
+-----------+----------+
| neha      | shukla   |
| priya     | pandey   |
| niraj     | singh    |
| abhishek  | pandey   |
+-----------+----------+
4 rows in set (0.00 sec)


